{
  "kind": "salary_change",
  "number": "78",
  "issued_on": "15.08.2026",
  "employer": {
    "name": "Cyber Capybara ТОО",
    "bin": "104332181962"
  },
  "employee": {
    "full_name": "Серикбаева Айгерим Кайратовна",
    "iin": "900112350487",
    "position": "Бухгалтер"
  },
  "effective_from": "01.09.2026",
  "details": "Оклад 450 000,00 тенге",
  "reason": "Изменение штатного расписания от 15.08.2026",
  "director": "Ахметов Ерлан Серикович"
}
