{
  "kind": "hire",
  "number": "42",
  "issued_on": "14.08.2026",
  "employer": {
    "name": "Cyber Capybara ТОО",
    "bin": "104332181962"
  },
  "employee": {
    "full_name": "Серикбаева Айгерим Кайратовна",
    "iin": "900112350487",
    "position": "Бухгалтер"
  },
  "effective_from": "18.08.2026",
  "effective_to": "17.11.2026",
  "reason": "Трудовой договор № 17 от 14.08.2026, заявление работника от 12.08.2026",
  "details": "Испытательный срок 3 месяца, оклад 300 000,00 тенге",
  "director": "Ахметов Ерлан Серикович"
}
