{
  "kind": "vacation",
  "number": "91",
  "issued_on": "15.08.2026",
  "employer": {
    "name": "Cyber Capybara ТОО",
    "bin": "104332181962"
  },
  "employee": {
    "full_name": "Серикбаева Айгерим Кайратовна",
    "iin": "900112350487",
    "position": "Бухгалтер"
  },
  "effective_from": "01.09.2026",
  "details": "Жыл сайынғы ақылы демалыс / Ежегодный оплачиваемый отпуск",
  "reason": "Қызметкердің өтініші / Заявление работника от 12.08.2026",
  "director": "Ахметов Ерлан Серикович"
}
