{
  "kind": "dismiss",
  "number": "SC-1",
  "issued_on": "14.08.2026",
  "employer": {
    "name": "Работодатель Тестов ТОО",
    "bin": "104332181962"
  },
  "employee": {
    "full_name": "Работников Р.Р.",
    "iin": "900112350487",
    "position": "Тестировщик"
  },
  "effective_from": "18.08.2026",
  "reason": "50% & \"к\" #1 _t_ {б} \\б $5 ^верх ~тильда <уголки>",
  "director": "Тестов Т.Т."
}
