{
  "kind": "business_trip",
  "number": "77",
  "issued_on": "15.08.2026",
  "employer": {
    "name": "Cyber Capybara ТОО",
    "bin": "104332181962"
  },
  "employee": {
    "full_name": "Ахметов Ерлан Серикович",
    "iin": "870304300215",
    "position": "Директор"
  },
  "effective_from": "24.08.2026",
  "effective_to": "28.08.2026",
  "details": "Астана қаласы / город Астана, переговоры с контрагентом",
  "reason": "Служебное задание № 9 от 15.08.2026",
  "director": "Ахметов Ерлан Серикович"
}
